{
  "$schema": "https://json-schema.org/draft/2020-12/schema",
  "title": "place_call",
  "description": "Place an outbound phone call on the principal's behalf to accomplish a goal (e.g. a reservation or appointment). The assistant MUST collect every required field from the user before calling this tool. If a required field is missing or ambiguous, ASK the user — do not guess. DATA MINIMIZATION: in `principal.facts`, include ONLY the personal data plausibly needed for THIS specific call_type — never the user's whole profile. Choose the minimal subset (e.g. a repair-confirmation may need service_address; a dinner reservation needs none). PII CONVENTION: put personal/identifying data (address, member id, DOB, account number, etc.) in `principal.facts` (disclosed only if the business asks), and keep `request.scenario_details` for NON-PII call specifics (service_type, party_size, occasion). After assembling the arguments, read them back to the user in plain language — INCLUDING exactly which personal data types will be available to the agent (the names of the keys in principal.facts, plus name/callback_number) — and get confirmation before invoking. This tool is fire-and-forget: it returns a call_id immediately; the result is retrieved on demand via get_call_outcome (Retell is the system of record).",
  "type": "object",
  "required": ["call_type", "target", "principal", "request"],
  "additionalProperties": false,
  "properties": {

    "call_type": {
      "type": "string",
      "title": "Call type / scenario id",
      "examples": ["haircut", "restaurant_reservation", "dentist_cleaning", "general_inquiry"],
      "description": "Open-ended scenario id, lowercase snake/kebab (e.g. 'haircut', 'restaurant_reservation', 'dentist_cleaning', 'general_inquiry'). If a matching scenario profile exists, it supplies recommended fields, default flexibility, direction hints, and confirm items. Unknown types fall back to generic behavior."
    },

    "target": {
      "type": "object",
      "description": "The business being called.",
      "required": ["business_name", "phone_number"],
      "additionalProperties": false,
      "properties": {
        "business_name": { "type": "string", "title": "Business name", "description": "Name of the business, used by the agent when speaking." },
        "phone_number": {
          "type": "string",
          "title": "Business phone number (E.164)",
          "examples": ["+15555550199", "+81312345678"],
          "pattern": "^\\+[1-9]\\d{6,14}$"
        },
        "timezone": { "type": "string", "title": "Business timezone (IANA)", "examples": ["America/New_York", "Asia/Tokyo"], "description": "IANA tz of the business, e.g. America/New_York. Infer from area code if not given, then confirm." }
      }
    },

    "principal": {
      "type": "object",
      "description": "The person the call is placed on behalf of. Stable identity + an OPEN grounding bag. This tool does not source grounding itself — the host LLM populates `facts` from the user's standing profile and/or other connected MCPs (WorkIQ, Gmail, calendar, CRM, etc.).",
      "required": [],
      "additionalProperties": false,
      "properties": {
        "name": { "type": "string", "title": "Principal name", "x-pii": true, "description": "Name to give for the reservation/appointment. OPTIONAL — omit for general inquiries where no booking/identity is involved, so the agent does not attach the principal's name to the call." },
        "anonymous": { "type": "boolean", "description": "Set true for a truly nameless call (general inquiries). Suppresses backfill of name/callback_number from config and places the call with NO principal identity. Default false (basics are backfilled for convenience)." },
        "callback_number": {
          "type": "string",
          "title": "Callback number (E.164)",
          "x-pii": true,
          "examples": ["+15555550142"],
          "pattern": "^\\+[1-9]\\d{6,14}$"
        },
        "facts": {
          "type": "object",
          "title": "Per-call PII subset",
          "x-pii": true,
          "description": "MINIMAL per-call subset of standing facts about the principal that the agent may share ONLY IF the business asks (never volunteer). Keys are snake_case labels the agent speaks humanized (e.g. service_address, account_number, date_of_birth, member_id, vehicle, insurance_provider, loyalty_number). Values are strings/numbers/booleans. DATA MINIMIZATION: include ONLY what THIS call_type plausibly needs — do NOT dump the user's full profile. The host LLM selects this subset from the user's standing profile and/or connected context MCPs (WorkIQ, Gmail, calendar, CRM). This is the right home for PII: anything identifying belongs here (only-if-asked + surfaced in the read-back), NOT in scenario_details. Distinct from request.scenario_details (non-PII call specifics).",
          "additionalProperties": { "type": ["string", "number", "boolean"] }
        },
        "facts_from_store": {
          "type": "array",
          "title": "Stored fact keys to resolve at dial time",
          "description": "OPTIONAL escape hatch. Names stored fact keys (from the user's saved profile) to pull into this call's share-if-asked set WITHOUT the value ever passing through you. Profile-recommended keys are auto-resolved from the store already, so use this only to include a stored key that the matched scenario profile does NOT recommend (e.g. member_id on a general_inquiry). Data minimization still applies: name only what THIS call needs. Values you already have go directly in `facts` instead.",
          "items": { "type": "string" }
        }
      }
    },

    "request": {
      "type": "object",
      "description": "What to actually accomplish. Shape these from the user's intent; ask for anything missing.",
      "required": ["summary", "preferred"],
      "additionalProperties": false,
      "properties": {
        "summary": {
          "type": "string",
          "title": "Request summary",
          "examples": ["Dinner reservation for 4", "Routine dental cleaning"],
          "description": "One sentence the agent can act on, e.g. 'Dinner reservation for 4'. For appointments, include the service, e.g. 'Routine dental cleaning'."
        },
        "opening_ask": {
          "type": "string",
          "minLength": 1,
          "maxLength": 180,
          "pattern": "^[^\\r\\n]+$",
          "title": "Opening ask (spoken)",
          "examples": ["I'm calling to ask whether you have a table for two this Friday at 6 PM.", "金曜日18時に2名で空席があるか伺えますでしょうか。"],
          "description": "OPTIONAL. One short purpose or question spoken after the greeting and before the AI disclosure. Maximum 180 characters, one question only, with no greeting, disclosure, background, clarification, or second step. If omitted, one is derived from `summary`. Do NOT phrase as 'is now a good time?'."
        },
        "party_size": { "type": "integer", "minimum": 1, "description": "Required for reservations. Number of people." },
        "max_party_size": { "type": "integer", "minimum": 1, "description": "Negotiation ceiling; agent will not accept a larger booking. Defaults to party_size if omitted." },
        "preferred": {
          "type": "object",
          "description": "The first-choice date/time. The agent aims for this before falling back. If acceptable_windows is omitted, a single window is derived from this plus the flexibility minutes.",
          "required": ["date", "time"],
          "additionalProperties": false,
          "properties": {
            "date": { "type": "string", "format": "date", "examples": ["2026-07-10"], "description": "YYYY-MM-DD. Resolve relative dates ('Saturday') against the business timezone and confirm the absolute date." },
            "time": { "type": "string", "pattern": "^([01]\\d|2[0-3]):[0-5]\\d$", "examples": ["19:00"], "description": "24h HH:MM." }
          }
        },
        "acceptable_windows": {
          "type": "array",
          "description": "OPTIONAL ordered fallback ladder. The agent negotiates DOWN this list and accepts nothing outside it. If omitted, one window is derived from `preferred` +/- the flexibility minutes (default 45). Provide explicitly when the user names multiple fallback dates/times.",
          "minItems": 1,
          "items": {
            "type": "object",
            "required": ["date", "earliest", "latest"],
            "additionalProperties": false,
            "properties": {
              "date": { "type": "string", "format": "date" },
              "earliest": { "type": "string", "pattern": "^([01]\\d|2[0-3]):[0-5]\\d$" },
              "latest": { "type": "string", "pattern": "^([01]\\d|2[0-3]):[0-5]\\d$" }
            }
          }
        }
      }
    },

    "scenario_details": {
      "type": "object",
      "description": "NON-PII scenario specifics keyed by the matching profile (e.g. for 'haircut': stylist, service_type, hair_length; for a reservation: occasion). These are spoken PROACTIVELY by the agent during the call, so DO NOT put personal/identifying data here (address, member id, DOB, phone, account number) — that belongs in principal.facts (only-if-asked). The profile lists which keys are recommended; the dispatcher warns when recommended keys are missing and speaks the provided ones during the call. Open-ended bag — any string/number/boolean values allowed.",
      "additionalProperties": { "type": ["string", "number", "boolean"] }
    },

    "preferences": {
      "type": "array",
      "description": "Nice-to-haves, ranked. Never blockers. e.g. 'Quieter table', 'Patio over bar'.",
      "items": { "type": "string" }
    },

    "constraints": {
      "type": "array",
      "description": "Things the agent must proactively raise/verify, e.g. 'Nut allergy — confirm kitchen can accommodate', 'Wheelchair access needed'.",
      "items": { "type": "string" }
    },

    "must_confirm": {
      "type": "array",
      "description": "Fields the agent reads back to the business before ending the call. Defaults to date, time, party_size, name.",
      "items": { "type": "string" }
    },

    "do_not_volunteer": {
      "type": "array",
      "description": "Facts the agent may USE if asked but must NOT offer proactively (PII minimization). e.g. 'callback_number'.",
      "items": { "type": "string" }
    },

    "anticipated_qa": {
      "type": "array",
      "description": "Pre-answers to likely business questions, to avoid awkward pauses. Optional but improves call quality.",
      "items": {
        "type": "object",
        "required": ["q", "a"],
        "additionalProperties": false,
        "properties": {
          "q": { "type": "string" },
          "a": { "type": "string" }
        }
      }
    },

    "overrides": {
      "type": "object",
      "description": "Optional per-call overrides of the direction template defaults. Omit to use template defaults.",
      "additionalProperties": false,
      "properties": {
        "time_flexibility_minutes": { "type": "integer", "minimum": 0, "default": 45, "title": "Time flexibility (minutes)" },
        "disclose_ai": { "type": "boolean", "default": true, "description": "Default true. Do not set false without a legal reason." },
        "record_audio": { "type": "boolean", "default": false, "description": "Default false. If true, agent must speak a consent line." },
        "max_call_duration_seconds": { "type": "integer", "minimum": 30, "title": "Max call duration (seconds)" },
        "on_voicemail": { "type": "string", "enum": ["leave_message", "hang_up"], "default": "leave_message" },
        "retry": {
          "type": "object",
          "description": "Retry-on-no-answer policy. Defaults to exactly 1 retry; never raise max_retries above 1 without an explicit user request (repeated calls are spammy).",
          "additionalProperties": false,
          "properties": {
            "max_retries": { "type": "integer", "minimum": 0, "maximum": 5, "default": 1, "description": "Number of re-dials on no-answer. Default 1. >1 only on explicit user request." },
            "on": { "type": "array", "default": ["no_answer", "busy", "failed"], "items": { "type": "string", "enum": ["no_answer", "busy", "failed"] } },
            "delay_seconds": { "type": "integer", "minimum": 0, "maximum": 600, "default": 60 }
          }
        }
      }
    },

    "notify": {
      "type": "object",
      "description": "Optional per-call 'text me when it's done'. Off by default — results are pulled on demand via get_call_outcome. Only set sms:true if the user asks to be notified.",
      "additionalProperties": false,
      "properties": {
        "sms": { "type": "boolean", "default": false, "description": "True = send the user an SMS when this call completes." },
        "to": { "type": "string", "title": "Notify number (E.164)", "x-pii": true, "description": "The user's own number to text (E.164). If omitted, uses the saved notify number; if none, ask the user." }
      }
    }
  }
}
